title,price
Pilas Energeizer AAA x 2 Unidades,2.69
Audífonos Inalámbricos Energy Sistem Style 2 True Coconut,47.04
Parlante Mini 3 Pro Souncore,69.99
"Televisor Samsung The Serif QLED Smart TV 4K 55""",1499.0
Parlante Energy Sistem Urban 2 Onyx,39.99
Cámara GoPro Hero 6 Black 12 MP,871.99
Micrófono Inalámbrico Profesional Bazzuka UHF 2 Transmisor,259.0
Audífonos Inalámbricos Energy Sistem Sport 2 True Negro,49.0
"Televisor Samsung The Frame QLED Smart TV 4K 65""",2799.0
"Televisor Samsung QLED Smart TV 4K 85""",4959.0
Parlante Energy Sistem Urban 2 Ocean,39.99
Pilas Energeizer AA x 2 Unidades,2.69
"Televisor Samsung QLED Smart TV 4K 70""",2518.99
Parlante Energy Sistem Urban 5+ Space,99.0
Audífonos Inalámbricos Bazzuka X201 Blanco/Gris,44.99
Parlante Bazzuka Negro 3.000 Watts PMPO,159.0
"Televisor Samsung Neo QLED Smart TV 8K 85""",9749.0
Audífonos Inalámbricos Energy Sistem Urban 4 True Vainilla,44.99
"Televisor Prima Smart Neo/Web Os 65""",999.01
Parlante Portable Bazzuka Rojo 7.5 Watts RMS,99.99
Parlante Doble Indigo 16.000 Watts PMPO,359.0
Audífonos Inalámbricos Bazzuka X201 Negro/Verde,44.99
Parlante Portable Bazzuka Negro 7.5 Watts RMS,99.99
Audífonos Inalámbricos Energy Sistem Sport 1 Ocean,29.99
"Televisor Prima LED Smart TV 4K 55"" WebOs",799.0
Parlante Portable Bazzuka Negro con Naranja 5 Watts RMS,48.99
Cámara de Seguridad con Movimiento 2K Eufy,92.99
Audífonos Inalámbricos Maxell Halo EB-BT,30.99
Parlante Amplificado Bazzuka B515,349.0
Audífonos Alámbricos BWOO BO-HF12,9.99
Parlante Flare 2 Soundcore,119.0
"Televisor Prima LED UHD Smart TV 50""",689.0
Audífonos Alámbricos Energy Sistem Style 1 Talk Negro,29.99
Interruptor Nexxt Smart WIFI,21.99
Parlante Profesional Bazzuka Negro 350 Watts RMS,409.0
Audífonos Inalámbricos Maxell BT750,26.88
Parlante Bazzuka Negro 250 Watts RMS,229.51
Parlante Italy Audio Negro,119.0
Audífonos Inalámbricos Energy Sistem Style 7 True Navy,140.0
Foco de Filamento Nexxt Smart WIFI Ambar 110V,19.0
"Televisor Indurama Google TV 50""",429.0
"Televisor Indurama Google TV 65""",999.01
Enchufe Inteligente Nexxt 2 Tomas,37.98
"Televisor Indurama Google TV 58""",652.97
Audífonos Inalámbricos Maxell Rojo,29.99
Sensor de Seguridad Maxell MSS-DWS1,29.99
"Televisor Indurama Google Tv 43""",499.0
Micrófono Inalámbrico Bazzuka UHF 2 Transmisor,119.0
Sensor de Movimiento Inteligente Maxell,39.0
Smart IR Controller Maxell,29.99
"Televisor Samsung Smartv 4K 75""",1285.0
"Televisor Qled Samsung 4K Q80B 98""",8498.99
Audífonos Gamer Havit H139d,17.99
Audífonos Alámbricos BWOO BO-HF20,7.0
Audífonos con Cancelación de Ruido Soundcore,124.99
Audifonos Life Q10 Tipo Diadema Soundcore,94.0
Micrófono Inalámbrico Bazzuka UHF 1 Transmisor,64.99
Audífonos Alámbricos Energy Sistem DJ2 Blanco,34.99
Audífonos Lol&Roll Pop Kids Naranja,7.99
Audífonos Alámbricos Energy Sistem Style 1+ Menta,9.99
Audífonos Lol&Roll Pop Kids Azul,7.99
Audífonos Lol&Roll Pop Kids Rosado,7.99
Audífonos Alámbricos Sony MDRE9LP,14.0
Audífonos Alámbricos Maxell HP-200,8.99
Audífonos Inalámbricos Maxell EB-BT100,20.99
Audífonos Alámbricos Maxell IN-225,5.99
Audífonos Alámbricos BWOO BO-HF23,11.01
Audífonos Gamer Havit H2116D,22.99
Parlante Profesional Bazzuka Negro 500 Watts RMS,739.99
"Televisor Riviera LED 32""",184.0
"Televisor Motorola 50TMKUHD Google Tv 50""",639.0
"Televisor Motorola 43TMKFHD Google Tv 43""",459.0
"Televisor Pirma con android 32""",259.0
Audífonos Cubitt Gen2,45.0
Streaming Roku Express 4K Hdr Wifi Compatible Google/alexa Negro,119.0
Streaming Roku Express 4K Hdr Wifi  Compatible Google/alexa Negro,99.0
Parlante JBL Speaker Flip 6 BT Blue S. Ame,135.0
"Televisor Riviera LED UHD 4K 65""",639.0
Parlante Bazzuka Negro 50.000 Watts PMPO,279.99
Parlante JBL Speaker BT Boombox 3 Camouflaje,499.0
Audífonos Cubitt Gen2,45.0
Audífonos Cubitt,50.0
"Televisor Motorola 86TMKQLED Google Tv 86""",1999.0
"Televisor Motorola 65TMKQLED Google Tv 65""",1099.0
"Televisor Motorola 55TMKUHD Google Tv 55""",799.0
Audífonos JBL T500 Wired On-Ear Black S. Ame,46.99
Parlante Bazzuka Profesional P315W,559.0
Parlante Sudio S2 Inalámbrico Negro,71.0
Parlante Sudio S2 Inalámbrico Gris,71.0
Cerradura Kwikset Halo Smart con Código-250 Usuarios Táctil Historial Niquel Satinado,284.0
Cerradura Kwikset Halo Smart con Código-250 Usuarios Táctil Historial Negro Mate,284.0
Cerradura Kwikset Halo Smart 100 Huellas Dactilares Historial Niquel Satinado,310.01
Cerradura Kwikset Halo Smart 100 Huellas Dactilares Historial Negro Mate,310.01
Cámara Para Auto Geko 1.5 Pulg. Full Hd 132 1.5 Wifi Espejo Punto Ciego Negro,133.99
Audífonos Sudio N2 Pro Inalámbrico Estilo Tapon 10Mm Bt-Microf. Integr. 30H Dur. Usb-C Ipx4 Blanco,140.0
Audífonos Sudio A1 Pro Inalámbrico Estilo con cancelación de Ruido Purpura,94.0
Audífonos Sudio A1 Pro Inalámbrico Estilo con cancelación de Ruido Negro,94.0
Audífonos Sudio A1 Pro Inalámbrico Estilo con cancelación de Ruido Color Arena,94.0
Audífonos Sudio A1 Inalámbrico Estilo con cancelación de Ruido Purpura,70.09
Audífonos Sudio A1 Inalámbrico Estilo con cancelación de Ruido Negro,70.09
Audífonos Sudio A1 Inalámbrico Estilo con cancelación de Ruido Blanco,70.09
Audífonos Sudio A1 Inalámbrico Estilo con cancelación de Ruido Azul,70.09
Audífonos Skullcandy Jib In Ear W/Mic,13.0
Audífonos Skullcandy Push Active True Wireless In Ear,159.0
Audífonos Skullcandy Mod True Wireless In Ear,99.0
Audífonos Skullcandy Hesh Evo Wireless Over-Ear,159.0
Audífonos Skullcandy Hesh Anc Wireless Over-Ear,229.0
Audífonos Skullcandy Jib True Wireless In Ear,69.99
Audífonos Skullcandy Dime True Wireless In Ear,60.0
Audífonos Devia con Micrófono Blanco,7.99
Timbre inteligente con cámara y conexión Wi-Fi,109.0
Cámara inteligente Wi-Fi con reflectores y detector de movimiento integrados,149.99
Audífonos JBL Headphone T500 Wired On-ear Azul,39.99
